[
  {
    "source_node": "William Stewart Halsted",
    "source_node_type": "person",
    "target_node": "Johns Hopkins Hospital Department of Surgery",
    "target_node_type": "institution",
    "edge_type": "institutional_founder",
    "start_year": 1889,
    "end_year": 1922,
    "temporal_range": "1889-1922",
    "evidence_citation": "PMID: 2446524",
    "evidence_type": "PMID",
    "evidence_locator": "https://pubmed.ncbi.nlm.nih.gov/2446524/",
    "confidence": "high",
    "notes": "Halsted established the first formal surgical residency training program in the United States, cementing the institutional root of modern surgical education."
  },
  {
    "source_node": "William Stewart Halsted",
    "source_node_type": "person",
    "target_node": "John Finney",
    "target_node_type": "person",
    "edge_type": "direct_training",
    "start_year": 1889,
    "end_year": 1899,
    "temporal_range": "1889-1899",
    "evidence_citation": "PMID: 26645476",
    "evidence_type": "PMID",
    "evidence_locator": "https://pubmed.ncbi.nlm.nih.gov/26645476/",
    "confidence": "high",
    "notes": "Finney served as Halsted's first resident and primary deputy, serving as the critical bridge to the next generation of American general surgeons."
  },
  {
    "source_node": "William Stewart Halsted",
    "source_node_type": "person",
    "target_node": "Joseph Bloodgood",
    "target_node_type": "person",
    "edge_type": "direct_training",
    "start_year": 1892,
    "end_year": 1897,
    "temporal_range": "1892-1897",
    "evidence_citation": "PMID: 29681553",
    "evidence_type": "PMID",
    "evidence_locator": "https://pubmed.ncbi.nlm.nih.gov/29681553/",
    "confidence": "high",
    "notes": "Bloodgood trained under Halsted and institutionalized surgical pathology as a mandatory core competency within surgical training."
  },
  {
    "source_node": "William Stewart Halsted",
    "source_node_type": "person",
    "target_node": "Hugh Hampton Young",
    "target_node_type": "person",
    "edge_type": "direct_training",
    "start_year": 1895,
    "end_year": 1898,
    "temporal_range": "1895-1898",
    "evidence_citation": "PMID: 2446524",
    "evidence_type": "PMID",
    "evidence_locator": "https://pubmed.ncbi.nlm.nih.gov/2446524/",
    "confidence": "high",
    "notes": "Young trained as an assistant surgeon under Halsted before being appointed to head the genitourinary dispensary in 1897."
  },
  {
    "source_node": "William Stewart Halsted",
    "source_node_type": "person",
    "target_node": "Harvey Cushing",
    "target_node_type": "person",
    "edge_type": "direct_training",
    "start_year": 1896,
    "end_year": 1912,
    "temporal_range": "1896-1912",
    "evidence_citation": "PMID: 28489324",
    "evidence_type": "PMID",
    "evidence_locator": "https://pubmed.ncbi.nlm.nih.gov/28489324/",
    "confidence": "high",
    "notes": "Cushing served as Halsted's resident and later established the Hunterian Laboratory."
  },
  {
    "source_node": "William Stewart Halsted",
    "source_node_type": "person",
    "target_node": "John Homans",
    "target_node_type": "person",
    "edge_type": "direct_training",
    "start_year": 1903,
    "end_year": 1904,
    "temporal_range": "1903-1904",
    "evidence_citation": "PMID: 10871146",
    "evidence_type": "PMID",
    "evidence_locator": "https://pubmed.ncbi.nlm.nih.gov/10871146/",
    "confidence": "high",
    "notes": "Homans completed early surgical training under Halsted before joining Cushing at Brigham, heavily influenced by Halsted's physiological approach."
  },
  {
    "source_node": "William Stewart Halsted",
    "source_node_type": "person",
    "target_node": "George Heuer",
    "target_node_type": "person",
    "edge_type": "direct_training",
    "start_year": 1907,
    "end_year": 1914,
    "temporal_range": "1907-1914",
    "evidence_citation": "PMID: 2446524",
    "evidence_type": "PMID",
    "evidence_locator": "https://pubmed.ncbi.nlm.nih.gov/2446524/",
    "confidence": "high",
    "notes": "Heuer served as Halsted's chief resident and later became chairman of surgery at Cornell/New York Hospital."
  },
  {
    "source_node": "William Stewart Halsted",
    "source_node_type": "person",
    "target_node": "Barney Brooks",
    "target_node_type": "person",
    "edge_type": "direct_training",
    "start_year": 1911,
    "end_year": 1914,
    "temporal_range": "1911-1914",
    "evidence_citation": "PMID: 13032549",
    "evidence_type": "PMID",
    "evidence_locator": "https://pubmed.ncbi.nlm.nih.gov/13032549/",
    "confidence": "high",
    "notes": "Brooks trained at Hopkins under Halsted before moving to Washington University and eventually Vanderbilt."
  },
  {
    "source_node": "William Stewart Halsted",
    "source_node_type": "person",
    "target_node": "Howard Naffziger",
    "target_node_type": "person",
    "edge_type": "direct_training",
    "start_year": 1912,
    "end_year": 1914,
    "temporal_range": "1912-1914",
    "evidence_citation": "UCSF_Archive_Naffziger",
    "evidence_type": "institutional_archive",
    "evidence_locator": "UCSF Department of Surgery Historical Archives; Naffziger Society History",
    "confidence": "high",
    "notes": "Naffziger served as assistant resident surgeon at Johns Hopkins under Halsted and Cushing, recognizing the superiority of the Halstedian training system before returning to build UCSF."
  },
  {
    "source_node": "William Stewart Halsted",
    "source_node_type": "person",
    "target_node": "Mont Reid",
    "target_node_type": "person",
    "edge_type": "direct_training",
    "start_year": 1914,
    "end_year": 1918,
    "temporal_range": "1914-1918",
    "evidence_citation": "PMID: 2446524",
    "evidence_type": "PMID",
    "evidence_locator": "https://pubmed.ncbi.nlm.nih.gov/2446524/",
    "confidence": "high",
    "notes": "Reid served as Halsted's resident and was a key adopter of his meticulous tissue handling techniques."
  },
  {
    "source_node": "Johns Hopkins Hospital Department of Surgery",
    "source_node_type": "institution",
    "target_node": "Warfield Firor",
    "target_node_type": "person",
    "edge_type": "direct_training",
    "start_year": 1917,
    "end_year": 1921,
    "temporal_range": "1917-1921",
    "evidence_citation": "JHU_Professorship_Archive",
    "evidence_type": "institutional_archive",
    "evidence_locator": "Johns Hopkins University Named Professorships (professorships.jhu.edu/professorship/warfield-m-firor-professor-in-surgery/)",
    "confidence": "high",
    "notes": "Warfield M. Firor received his A&S degree from Johns Hopkins in 1917 and his MD in 1921, training in surgery under the Halstedian system. Halsted died in September 1922, making Firor among the last surgeons formed directly within the original Halsted program. Firor became professor of surgery at the School of Medicine and acting surgeon-in-chief of the hospital from 1939 to 1941. He was best known for pioneering work on tetanus toxin and its effect on the spinal cord. He chaired the American Board of Surgery and the Joint Conference Committee on Graduate Training in Surgery. JHU awarded him an honorary doctorate in 1980. He died in 1988 at age 91. An endowed professorship in his name is currently held at Hopkins."
  },
  {
    "source_node": "William Stewart Halsted",
    "source_node_type": "person",
    "target_node": "Emile Holman",
    "target_node_type": "person",
    "edge_type": "direct_training",
    "start_year": 1919,
    "end_year": 1923,
    "temporal_range": "1919-1923",
    "evidence_citation": "PMID: 4885802",
    "evidence_type": "PMID",
    "evidence_locator": "https://pubmed.ncbi.nlm.nih.gov/4885802/",
    "confidence": "high",
    "notes": "Holman was Halsted's final chief resident before Halsted's death in 1922."
  },
  {
    "source_node": "Johns Hopkins Hospital Department of Surgery",
    "source_node_type": "institution",
    "target_node": "J. Deryl Hart",
    "target_node_type": "person",
    "edge_type": "direct_training",
    "start_year": 1920,
    "end_year": 1925,
    "temporal_range": "1920-1925",
    "evidence_citation": "Duke_Archive_Hart",
    "evidence_type": "institutional_archive",
    "evidence_locator": "Duke University Medical Center Archives",
    "confidence": "high",
    "notes": "Hart trained at Hopkins under Halsted's system and was recruited to Duke as the founding chairman of surgery."
  },
  {
    "source_node": "Johns Hopkins Hospital Department of Surgery",
    "source_node_type": "institution",
    "target_node": "Alfred Blalock",
    "target_node_type": "person",
    "edge_type": "direct_training",
    "start_year": 1922,
    "end_year": 1925,
    "temporal_range": "1922-1925",
    "evidence_citation": "PMID: 31944636",
    "evidence_type": "PMID",
    "evidence_locator": "https://pubmed.ncbi.nlm.nih.gov/31944636/",
    "confidence": "high",
    "notes": "Blalock trained directly under the Halstedian system at Hopkins before returning as Chief of Surgery to perform the first blue baby operation."
  },
  {
    "source_node": "Johns Hopkins Hospital Department of Surgery",
    "source_node_type": "institution",
    "target_node": "Arthur Blakemore",
    "target_node_type": "person",
    "edge_type": "direct_training",
    "start_year": 1922,
    "end_year": 1926,
    "temporal_range": "1922-1926",
    "evidence_citation": "JHM_Archive_Blakemore",
    "evidence_type": "institutional_archive",
    "evidence_locator": "Johns Hopkins Medical Archives",
    "confidence": "high",
    "notes": "Blakemore trained at Hopkins before establishing the Columbia vascular lineage, linking early synthetic graft innovation back to Halsted."
  }
]
