[
  {
    "source_node": "John Hunter",
    "source_node_type": "person",
    "target_node": "Henry Cline",
    "target_node_type": "person",
    "edge_type": "direct_training",
    "start_year": 1777,
    "end_year": 1784,
    "temporal_range": "1777-1784",
    "evidence_citation": "Hunter_Archive_Cline",
    "evidence_type": "institutional_archive",
    "evidence_locator": "Royal College of Surgeons Historical Archives",
    "confidence": "moderate",
    "notes": "Cline trained under Hunter, establishing the early British scientific surgical tradition before the German model dominated."
  },
  {
    "source_node": "Bernhard von Langenbeck",
    "source_node_type": "person",
    "target_node": "Charité Berlin Department of Surgery",
    "target_node_type": "institution",
    "edge_type": "institutional_founder",
    "start_year": 1847,
    "end_year": 1882,
    "temporal_range": "1847-1882",
    "evidence_citation": "PMID: 20436531",
    "evidence_type": "PMID",
    "evidence_locator": "https://pubmed.ncbi.nlm.nih.gov/20436531/",
    "confidence": "high",
    "notes": "Langenbeck developed the German system of residency training at Charité, heavily influencing the later Halstedian model."
  },
  {
    "source_node": "Bernhard von Langenbeck",
    "source_node_type": "person",
    "target_node": "Theodor Billroth",
    "target_node_type": "person",
    "edge_type": "direct_training",
    "start_year": 1853,
    "end_year": 1860,
    "temporal_range": "1853-1860",
    "evidence_citation": "PMID: 20436531",
    "evidence_type": "PMID",
    "evidence_locator": "https://pubmed.ncbi.nlm.nih.gov/20436531/",
    "confidence": "high",
    "notes": "Billroth served as Langenbeck's assistant at Charité, internalizing the German academic surgical system before his move to Zurich and Vienna."
  },
  {
    "source_node": "Theodor Billroth",
    "source_node_type": "person",
    "target_node": "Vienna General Hospital Second Surgical Clinic",
    "target_node_type": "institution",
    "edge_type": "institutional_founder",
    "start_year": 1867,
    "end_year": 1894,
    "temporal_range": "1867-1894",
    "evidence_citation": "PMID: 15354259",
    "evidence_type": "PMID",
    "evidence_locator": "https://pubmed.ncbi.nlm.nih.gov/15354259/",
    "confidence": "high",
    "notes": "Billroth established the Vienna School of Surgery, pioneering gastrointestinal resections and early modern surgical morbidity tracking."
  },
  {
    "source_node": "Theodor Billroth",
    "source_node_type": "person",
    "target_node": "William Stewart Halsted",
    "target_node_type": "person",
    "edge_type": "observational_study",
    "start_year": 1878,
    "end_year": 1880,
    "temporal_range": "1878-1880",
    "evidence_citation": "PMID: 2446524",
    "evidence_type": "PMID",
    "evidence_locator": "https://pubmed.ncbi.nlm.nih.gov/2446524/",
    "confidence": "high",
    "notes": "Halsted spent two years traversing European surgical clinics, highly influenced by Billroth's scientific approach and Langenbeck's residency structure before returning to design the Hopkins system."
  },
  {
    "source_node": "Edward Churchill",
    "source_node_type": "person",
    "target_node": "Mediterranean Theater Surgical Service",
    "target_node_type": "institution",
    "edge_type": "institutional_founder",
    "start_year": 1943,
    "end_year": 1945,
    "temporal_range": "1943-1945",
    "evidence_citation": "MGH_Archive_Churchill_WWII",
    "evidence_type": "institutional_archive",
    "evidence_locator": "Massachusetts General Hospital Archives",
    "confidence": "high",
    "notes": "Churchill served as Surgical Consultant for the Mediterranean Theater, standardizing whole blood transfusions and delayed primary closure of war wounds, concepts that fundamentally altered civilian trauma care."
  },
  {
    "source_node": "Michael DeBakey",
    "source_node_type": "person",
    "target_node": "Mobile Army Surgical Hospital (MASH) System",
    "target_node_type": "institution",
    "edge_type": "institutional_founder",
    "start_year": 1943,
    "end_year": 1945,
    "temporal_range": "1943-1945",
    "evidence_citation": "PMID: 18693427",
    "evidence_type": "PMID",
    "evidence_locator": "https://pubmed.ncbi.nlm.nih.gov/18693427/",
    "confidence": "high",
    "notes": "Working in the Surgeon General's Office during WWII, DeBakey helped conceptualize the MASH units and the VA medical center system to manage the flow of combat casualties."
  },
  {
    "source_node": "Sterling Bunnell",
    "source_node_type": "person",
    "target_node": "United States Army Hand Surgery Centers",
    "target_node_type": "institution",
    "edge_type": "institutional_founder",
    "start_year": 1944,
    "end_year": 1947,
    "temporal_range": "1944-1947",
    "evidence_citation": "PMID: 12563656",
    "evidence_type": "PMID",
    "evidence_locator": "https://pubmed.ncbi.nlm.nih.gov/12563656/; PMC3825913 (https://pmc.ncbi.nlm.nih.gov/articles/PMC3825913/)",
    "confidence": "high",
    "notes": "Sterling Bunnell (1882-1957), a San Francisco general surgeon, was designated a special civilian consultant to the US Secretary of War at the request of Surgeon General Norman T. Kirk, an orthopedic surgeon. Between November 1944 and February 1947, Bunnell established and visited nine regional hand surgery centers at US Army general hospitals across the United States, organizing surgical treatment protocols and teaching standardized hand injury care. He shut down his private practice for two years to accomplish this. Simultaneously, he completed his seminal textbook 'Surgery of the Hand' (JB Lippincott, 1944), which became the authoritative reference for nearly 30 years. Bunnell's key insight was that hand surgery required a multidisciplinary approach — correlating orthopedics, plastic surgery, and neurosurgery — rather than fragmented care by separate specialists. The army hand centers institutionalized this principle. This military-to-civilian specialty creation pattern parallels the trauma lineage (Scudder→ACS COT, already in graph) and the MASH system (already in graph). The surgeons who directed these centers became the founding nucleus of the ASSH."
  },
  {
    "source_node": "Norman Rich",
    "source_node_type": "person",
    "target_node": "Vietnam Vascular Registry",
    "target_node_type": "institution",
    "edge_type": "institutional_founder",
    "start_year": 1966,
    "end_year": 2026,
    "temporal_range": "1966-Present",
    "evidence_citation": "WRAIR_Archive_Rich",
    "evidence_type": "institutional_archive",
    "evidence_locator": "Walter Reed Army Institute of Research Archives",
    "confidence": "high",
    "notes": "Rich established the registry to meticulously track combat vascular injuries, driving the definitive transition from arterial ligation to immediate primary repair in modern vascular trauma."
  },
  {
    "source_node": "Mobile Army Surgical Hospital (MASH) System",
    "source_node_type": "institution",
    "target_node": "Norman Rich",
    "target_node_type": "person",
    "edge_type": "observational_study",
    "start_year": 1966,
    "end_year": 1970,
    "temporal_range": "1966-1970",
    "evidence_citation": "WRAIR_Archive_Rich_Vietnam",
    "evidence_type": "institutional_archive",
    "evidence_locator": "Walter Reed Army Institute of Research Archives",
    "confidence": "high",
    "notes": "Rich utilized the forward surgical concepts pioneered by DeBakey's MASH system to build the Vietnam Vascular Registry."
  },
  {
    "source_node": "Bernhard von Langenbeck",
    "source_node_type": "person",
    "target_node": "Theodor Kocher",
    "target_node_type": "person",
    "edge_type": "direct_training",
    "start_year": 1865,
    "end_year": 1866,
    "temporal_range": "1865-1866",
    "evidence_citation": "PMID: 9465770",
    "evidence_type": "PMID",
    "evidence_locator": "https://pubmed.ncbi.nlm.nih.gov/9465770/",
    "confidence": "high",
    "notes": "Emil Theodor Kocher (1841-1917) studied under Langenbeck in Berlin during his post-doctoral study trip (1865-1866), along with visits to Billroth in Vienna and surgeons in London and Paris. Langenbeck and Billroth both recommended Kocher for the chair at Bern, which he assumed in 1872. He held this position for 45 years until his death. Kocher won the 1909 Nobel Prize in Physiology or Medicine for his work on the thyroid gland — the first surgeon to receive the Nobel Prize. He performed over 7,000 thyroidectomies, reducing mortality from 13% to 0.18%. This edge extends the European depth layer: Langenbeck→Kocher creates a parallel to the existing Langenbeck→Billroth→Halsted chain. Citation is Liebermann-Meffert D, 'Surgical triumvirate of Theodor Kocher, Harvey Cushing, and William Halsted,' World J Surg 2000;24(1):2-9.",
    "module": "14_global_military"
  },
  {
    "source_node": "Theodor Kocher",
    "source_node_type": "person",
    "target_node": "Harvey Cushing",
    "target_node_type": "person",
    "edge_type": "observational_study",
    "start_year": 1900,
    "end_year": 1901,
    "temporal_range": "1900-1901",
    "evidence_citation": "PMID: 9465770",
    "evidence_type": "PMID",
    "evidence_locator": "https://pubmed.ncbi.nlm.nih.gov/9465770/",
    "confidence": "high",
    "notes": "Harvey Cushing visited Kocher's clinic in Bern during his European Wanderjahr (1900-1901), conducting experimental research on intracranial pressure that led to the Cushing-Kocher theory. This is one of the most documented observational visits in surgical history. Cushing was already a Halsted trainee at Hopkins (existing edge in graph). This creates a second pathway to Cushing: Langenbeck→Kocher→Cushing (observational) alongside the existing Halsted→Cushing (direct_training), forming a triangulated European-American bridge. Citation same as training edge.",
    "module": "14_global_military"
  }
]
